{
  "schema_version": 1,
  "asset_id": "example-creature",
  "subject": {
    "revision": null,
    "glb_sha256": null
  },
  "stages": {
    "external_generation": {
      "status": "unknown",
      "provider": null,
      "tool_route": null,
      "base_glb_sha256": null
    },
    "refinement": {
      "status": "unknown",
      "tool": null
    },
    "independent_qa": {
      "status": "unknown",
      "scope": [],
      "evidence": []
    }
  }
}
